{
  "schemaVersion": 1,
  "recordId": "kamifuda-runner-gameyard-source-snapshot-2026-08-10",
  "gameId": "kamifuda-runner",
  "authorization": {
    "source": "owner-project-direction",
    "recordedAt": "2026-08-10T00:00:00+09:00",
    "taskId": "019fbbb1-910c-7652-9cb5-f27d8150dd88",
    "grantText": "provenance/kamifuda-runner/distribution-grant.md",
    "grantTextSha256": "97b0aff3731c30d84c7dabd05a957c4a115ce5d86b1fe97b341a07ee18c56ff6"
  },
  "sourceSnapshot": {
    "kind": "owner-provided-archive",
    "archiveAvailability": "owner-workspace-only",
    "archive": {
      "path": "games/kamifuda-runner-v4.zip",
      "sha256": "5f2d6469b12ec50674b80aaa45a2519cad67fbf4938921e61814a458241f7752",
      "entryCount": 12,
      "uncompressedBytes": 467437
    },
    "inventory": {
      "path": "provenance/kamifuda-runner/source-inventory.json",
      "sha256": "d80f69493c491a12526be5b69212207674ea7a538ad9c533d668d0f6abfffc56"
    },
    "importedRoot": "games/kamifuda-runner",
    "repository": null,
    "revision": null,
    "license": null
  },
  "permissions": {
    "actions": [
      "copy",
      "modify",
      "build",
      "public-host",
      "display-and-run",
      "distribute-source",
      "distribute-static-artifact"
    ],
    "venues": ["https://github.com/Hitsuki-Ban/GameYard", "GitHub Pages", "Cloudflare"],
    "licenseScope": "GameYard-project-only"
  },
  "productionBoundary": {
    "status": "production-admitted",
    "runtimeAdmissionIssue": 55,
    "excludedFromProductionInputs": [
      "games/kamifuda-runner-v4.zip",
      "games/kamifuda-runner/kamifuda-runner-v4-standalone.html",
      "games/kamifuda-runner/build.py",
      "games/kamifuda-runner-v3-standalone.html",
      "games/kamifuda-runner-v3.zip",
      "games/CHECKSUMS.txt"
    ]
  }
}
